{
  "componentName": "Input",
  "slug": "input-field",
  "sourceUrl": "https://experience.sap.com/fiori-design-web/input-field/",
  "purpose": "A single-line text input field for user data entry. Supports semantic input types (Text, Email, Number, Password, URL, Tel) and value state feedback (Error, Warning, Success, Information).",
  "whenToUse": [
    "Capture single-line user input in forms and filters",
    "Allow free-text entry where options are not predefined",
    "Provide search input with placeholder text",
    "Use type=Email or Number for semantic mobile keyboard"
  ],
  "whenNotToUse": [
    "Use Select when 4\u201312 fixed options exist",
    "Use ComboBox when many options with type-ahead needed",
    "Use DatePicker for date input",
    "Use TextArea for multi-line input"
  ],
  "doRules": [
    "Pair every Input with a Label component",
    "Use placeholder text only as a hint \u2014 never as a replacement for label",
    "Use valueState=Error with valueStateText message when validation fails",
    "Use type=\"Email\" or \"Number\" for semantic input types \u2014 improves mobile keyboard",
    "Show clear icon when user has typed (showClearIcon=true)"
  ],
  "dontRules": [
    "Do not use placeholder as the field label",
    "Do not communicate error state by red border alone \u2014 include text message",
    "Do not use Input when MultiInput, Select, or DatePicker fits better",
    "Do not skip the visible Label"
  ],
  "layoutGuidance": {
    "placement": "Inside a Form, FilterBar, or Dialog body.",
    "sizing": "Default 256px wide; resizes to fill form column.",
    "spacing": "Vertical spacing between fields: 8px (Compact), 16px (Cozy).",
    "alignment": "Left-aligned with Label above or to the left."
  },
  "contentGuidance": {
    "labelLength": "Placeholder \u2264 50 chars. Value visible up to field width.",
    "contentRules": [
      "Use sentence case for placeholders",
      "Indicate required fields with * via Label.required=true",
      "Provide valueStateText for error/warning states"
    ],
    "examples": [
      "Filter Artifacts",
      "Search",
      "Enter name",
      "name@company.com"
    ]
  },
  "responsiveBehavior": {
    "XL": "Full width of form column",
    "L": "Full width of form column",
    "M": "Single column stacked layout",
    "S": "Full viewport width with Label above"
  },
  "accessibilityGuidance": [
    {
      "category": "contrast",
      "requirement": "Border contrast \u2265 3:1 against background",
      "wcag": "1.4.11 (AA)"
    },
    {
      "category": "labeling",
      "requirement": "Every input MUST have visible or aria label",
      "wcag": "1.3.1 (A)"
    },
    {
      "category": "focus",
      "requirement": "Visible focus indicator on focused state",
      "wcag": "2.4.7 (AA)"
    },
    {
      "category": "status",
      "requirement": "Value state communicated by color AND icon AND text \u2014 not color alone",
      "wcag": "1.4.1 (A)"
    },
    {
      "category": "keyboard",
      "requirement": "Tab moves focus; Enter submits form"
    }
  ],
  "patterns": [
    "Form field",
    "Filter input",
    "Search",
    "Inline edit"
  ],
  "compatibility": {
    "worksWith": [
      "Label",
      "Form",
      "SimpleForm",
      "Toolbar",
      "Dialog",
      "FilterBar"
    ],
    "incompatible": [
      "Without Label",
      "Inside Table cell at S viewport (use inline edit pattern)"
    ]
  },
  "exceptions": [
    "Search input inside Shell uses Shell Search variant with rounded corners",
    "Read-only inputs use editable=false and lose border"
  ],
  "version": "2026.Q2",
  "lastChecked": "2026-06-25"
}