{
  "componentName": "Switch",
  "slug": "switch",
  "sourceUrl": "https://experience.sap.com/fiori-design-web/switch/",
  "purpose": "A binary toggle for instant on/off settings without explicit save. Provides immediate state change feedback.",
  "whenToUse": [
    "For instant binary settings (On/Off, Enabled/Disabled)",
    "In settings pages, account preferences",
    "When the state takes effect immediately without form submission"
  ],
  "whenNotToUse": [
    "For actions that need confirmation \u2014 use Button",
    "In forms requiring \"Save\" submission \u2014 use CheckBox",
    "For 3+ mutually exclusive options \u2014 use Select or RadioButton"
  ],
  "doRules": [
    "Use Switch for instant binary settings (On/Off)",
    "Use AcceptReject type for explicit approval workflows",
    "Provide a clear label describing what the switch controls",
    "Show feedback when state changes (toast, status update)"
  ],
  "dontRules": [
    "Do not use Switch for actions that need confirmation \u2014 use Button",
    "Do not use Switch in forms requiring \"Save\" \u2014 use CheckBox",
    "Do not omit the descriptive label"
  ],
  "layoutGuidance": {
    "placement": "Inside Form, settings panels.",
    "sizing": "52\u00d724px Compact / 60\u00d732px Cozy.",
    "spacing": "16px between switch rows.",
    "alignment": "Label left, switch right."
  },
  "contentGuidance": {
    "labelLength": "1\u20138 words describing the setting.",
    "contentRules": [
      "Use positive statements",
      "Describe the state when On",
      "Optionally provide customTextOn/Off"
    ],
    "examples": [
      "Receive email notifications",
      "Two-factor authentication"
    ]
  },
  "responsiveBehavior": {
    "XL": "Standard inline layout",
    "L": "Standard inline layout",
    "M": "Standard inline layout",
    "S": "Full-width row with label above"
  },
  "accessibilityGuidance": [
    {
      "category": "keyboard",
      "requirement": "Space toggles state",
      "wcag": "2.1.1 (A)"
    },
    {
      "category": "labeling",
      "requirement": "Pair with descriptive Label or use customTextOn/Off",
      "wcag": "1.3.1 (A)"
    },
    {
      "category": "status",
      "requirement": "State communicated by position AND color \u2014 not color alone",
      "wcag": "1.4.1 (A)"
    },
    {
      "category": "announcements",
      "requirement": "State change announced as \"On\" or \"Off\""
    }
  ],
  "patterns": [
    "Settings toggle",
    "Feature flag"
  ],
  "compatibility": {
    "worksWith": [
      "Label",
      "Form"
    ],
    "incompatible": [
      "Inside a form requiring explicit submit"
    ]
  },
  "exceptions": [
    "AcceptReject type uses semantic colors (green/red) for approval workflows"
  ],
  "version": "2026.Q2",
  "lastChecked": "2026-06-25"
}