{
  "componentName": "DynamicPage",
  "slug": "dynamic-page",
  "sourceUrl": "https://experience.sap.com/fiori-design-web/dynamic-page-layout/",
  "purpose": "A page-layout container with a snappable header, sticky title, and scrollable content. The base for Object Page and many other floorplans.",
  "whenToUse": [
    "For pages with header metadata + main content",
    "For Object Page floorplan",
    "When header should collapse on scroll"
  ],
  "whenNotToUse": [
    "For simple forms \u2014 use Form directly",
    "For full-screen dialogs \u2014 use Dialog",
    "For wizards \u2014 use Wizard"
  ],
  "doRules": [
    "Use DynamicPage for Object Page floorplan",
    "Always include DynamicPageTitle and content section",
    "Use DynamicPageHeader for snappable metadata",
    "Set showFooter when destructive actions need persistent visibility"
  ],
  "dontRules": [
    "Do not use DynamicPage for simple forms \u2014 use Form",
    "Do not nest DynamicPage inside DynamicPage",
    "Do not omit DynamicPageTitle"
  ],
  "layoutGuidance": {
    "placement": "Full content area below ShellBar.",
    "sizing": "Full viewport height.",
    "spacing": "Title 48px, header variable, content fills.",
    "alignment": "Vertical stack: title \u2192 header \u2192 content \u2192 footer."
  },
  "contentGuidance": {
    "labelLength": "N/A (container)",
    "contentRules": [
      "Use semantic slots: title, header, content, footer"
    ],
    "examples": []
  },
  "responsiveBehavior": {
    "XL": "Full layout",
    "L": "Full layout",
    "M": "Header may collapse to save space",
    "S": "Header collapsed by default; expand on tap"
  },
  "accessibilityGuidance": [
    {
      "category": "keyboard",
      "requirement": "Header collapse/expand via keyboard",
      "wcag": "2.1.1 (A)"
    },
    {
      "category": "announcements",
      "requirement": "Title is announced as page heading"
    }
  ],
  "patterns": [
    "Object Page",
    "Detail page"
  ],
  "compatibility": {
    "worksWith": [
      "DynamicPageTitle",
      "DynamicPageHeader",
      "IconTabBar",
      "ObjectPageLayout"
    ],
    "incompatible": [
      "Inside Dialog",
      "Inside Card"
    ]
  },
  "exceptions": [
    "preserveHeaderStateOnScroll prevents collapse on scroll"
  ],
  "version": "2026.Q2",
  "lastChecked": "2026-06-25"
}